[
 {
  "schema": "viralstudio.scene.v2",
  "scene_id": "sc001",
  "audio_start_s": 0.0,
  "audio_end_s": 3.433333,
  "start_frame": 0,
  "end_frame": 103,
  "exact_narration": "¿Por qué las palomas mueven la cabeza al caminar?",
  "word_ids": [
   "w0001",
   "w0002",
   "w0003",
   "w0004",
   "w0005",
   "w0006",
   "w0007",
   "w0008",
   "w0009"
  ],
  "visual_justification": "«palomas» → pigeon_01; «caminar» → pigeon_01.walk; «cabeza» → primer plano de head",
  "render_backend": "layered2d",
  "template": "character_scene",
  "asset_ids": [
   "pigeon_rig_v1",
   "plaza_layered_v1"
  ],
  "character_ids": [
   "pigeon_01"
  ],
  "action_beats": [
   {
    "at_s": 2.52,
    "word_id": "w0009",
    "action": "walk",
    "target": "pigeon_01"
   }
  ],
  "camera": {
   "shot": "wide",
   "movement": "slow_push",
   "focus": {
    "target": "pigeon_01",
    "part": "head"
   },
   "focus_word": "w0007",
   "focus_at_s": 1.92
  },
  "overlays": [],
  "caption_policy": "word_timed",
  "revision": 1,
  "narration_source": "original_audio",
  "tts_used": false
 },
 {
  "schema": "viralstudio.scene.v2",
  "scene_id": "sc002",
  "audio_start_s": 3.433333,
  "audio_end_s": 8.933333,
  "start_frame": 103,
  "end_frame": 268,
  "exact_narration": "Mira esta paloma en la plaza. Un niño la observa desde un banco sorprendido.",
  "word_ids": [
   "w0010",
   "w0011",
   "w0012",
   "w0013",
   "w0014",
   "w0015",
   "w0016",
   "w0017",
   "w0018",
   "w0019",
   "w0020",
   "w0021",
   "w0022",
   "w0023"
  ],
  "visual_justification": "«paloma» → pigeon_01; «niño» → person_01; «plaza» → escenario plaza_layered_01; «Mira» → person_01.look_right; «observa» → person_01.look_left; «sorprendido» → person_01.surprise",
  "render_backend": "layered2d",
  "template": "character_scene",
  "asset_ids": [
   "bench_v1",
   "person_rig_v1",
   "pigeon_rig_v1",
   "plaza_layered_v1"
  ],
  "character_ids": [
   "pigeon_01",
   "person_01"
  ],
  "action_beats": [
   {
    "at_s": 3.54,
    "word_id": "w0010",
    "action": "look_right",
    "target": "person_01"
   },
   {
    "at_s": 6.38,
    "word_id": "w0019",
    "action": "look_left",
    "target": "person_01"
   },
   {
    "at_s": 7.72,
    "word_id": "w0023",
    "action": "surprise",
    "target": "person_01"
   }
  ],
  "camera": {
   "shot": "medium",
   "movement": "orbit"
  },
  "overlays": [],
  "caption_policy": "word_timed",
  "revision": 2,
  "narration_source": "original_audio",
  "tts_used": false
 },
 {
  "schema": "viralstudio.scene.v2",
  "scene_id": "sc003",
  "audio_start_s": 8.933333,
  "audio_end_s": 13.9,
  "start_frame": 268,
  "end_frame": 417,
  "exact_narration": "Su cuerpo avanza, pero la cabeza se queda quieta en el aire.",
  "word_ids": [
   "w0024",
   "w0025",
   "w0026",
   "w0027",
   "w0028",
   "w0029",
   "w0030",
   "w0031",
   "w0032",
   "w0033",
   "w0034",
   "w0035"
  ],
  "visual_justification": "«avanza» → pigeon_01.walk; «quieta» → pigeon_01.head_stabilize; «cuerpo» → primer plano de body",
  "render_backend": "layered2d",
  "template": "closeup",
  "asset_ids": [
   "guide_line",
   "pigeon_rig_v1",
   "plaza_layered_v1"
  ],
  "character_ids": [
   "pigeon_01"
  ],
  "action_beats": [
   {
    "at_s": 9.44,
    "word_id": "w0026",
    "action": "walk",
    "target": "pigeon_01"
   },
   {
    "at_s": 11.32,
    "word_id": "w0032",
    "action": "head_stabilize",
    "target": "pigeon_01"
   }
  ],
  "camera": {
   "shot": "closeup",
   "movement": "push_in",
   "focus": {
    "target": "pigeon_01",
    "part": "body"
   },
   "focus_word": "w0025",
   "focus_at_s": 9.16
  },
  "overlays": [
   {
    "type": "guide_line",
    "word": "w0032",
    "target": "pigeon_01",
    "part": "head",
    "at_s": 11.32
   }
  ],
  "caption_policy": "word_timed",
  "revision": 1,
  "narration_source": "original_audio",
  "tts_used": false
 },
 {
  "schema": "viralstudio.scene.v2",
  "scene_id": "sc004",
  "audio_start_s": 13.9,
  "audio_end_s": 16.733333,
  "start_frame": 417,
  "end_frame": 502,
  "exact_narration": "Luego da un salto rápido hacia adelante.",
  "word_ids": [
   "w0036",
   "w0037",
   "w0038",
   "w0039",
   "w0040",
   "w0041",
   "w0042"
  ],
  "visual_justification": "«salto» → pigeon_01.hop",
  "render_backend": "layered2d",
  "template": "character_scene",
  "asset_ids": [
   "person_rig_v1",
   "pigeon_rig_v1",
   "plaza_layered_v1"
  ],
  "character_ids": [
   "pigeon_01",
   "person_01"
  ],
  "action_beats": [
   {
    "at_s": 14.71,
    "word_id": "w0039",
    "action": "hop",
    "target": "pigeon_01"
   }
  ],
  "camera": {
   "shot": "wide",
   "movement": "pan_left"
  },
  "overlays": [],
  "caption_policy": "word_timed",
  "revision": 1,
  "narration_source": "original_audio",
  "tts_used": false
 },
 {
  "schema": "viralstudio.scene.v2",
  "scene_id": "sc005",
  "audio_start_s": 16.733333,
  "audio_end_s": 19.466667,
  "start_frame": 502,
  "end_frame": 584,
  "exact_narration": "Lo hace unas 15 veces por segundo.",
  "word_ids": [
   "w0043",
   "w0044",
   "w0045",
   "w0046",
   "w0047",
   "w0048",
   "w0049"
  ],
  "visual_justification": "cifra narrada «15» → contador 15",
  "render_backend": "layered2d",
  "template": "character_scene",
  "asset_ids": [
   "counter_badge",
   "person_rig_v1",
   "pigeon_rig_v1",
   "plaza_layered_v1"
  ],
  "character_ids": [
   "pigeon_01",
   "person_01"
  ],
  "action_beats": [],
  "camera": {
   "shot": "medium",
   "movement": "pull_out"
  },
  "overlays": [
   {
    "type": "counter_badge",
    "word": "w0046",
    "value": 15.0,
    "label": "veces por segundo",
    "at_s": 17.47
   }
  ],
  "caption_policy": "word_timed",
  "revision": 1,
  "narration_source": "original_audio",
  "tts_used": false
 },
 {
  "schema": "viralstudio.scene.v2",
  "scene_id": "sc006",
  "audio_start_s": 19.466667,
  "audio_end_s": 22.996,
  "start_frame": 584,
  "end_frame": 690,
  "exact_narration": "Así ve el mundo nítido como una cámara estable.",
  "word_ids": [
   "w0050",
   "w0051",
   "w0052",
   "w0053",
   "w0054",
   "w0055",
   "w0056",
   "w0057",
   "w0058"
  ],
  "visual_justification": "«estable» → pigeon_01.head_stabilize",
  "render_backend": "layered2d",
  "template": "character_scene",
  "asset_ids": [
   "camera_v1",
   "guide_line",
   "person_rig_v1",
   "pigeon_rig_v1",
   "plaza_layered_v1"
  ],
  "character_ids": [
   "pigeon_01",
   "person_01"
  ],
  "action_beats": [
   {
    "at_s": 21.77,
    "word_id": "w0058",
    "action": "head_stabilize",
    "target": "pigeon_01"
   }
  ],
  "camera": {
   "shot": "wide",
   "movement": "track"
  },
  "overlays": [
   {
    "type": "guide_line",
    "word": "w0058",
    "target": "pigeon_01",
    "part": "head",
    "at_s": 21.77
   }
  ],
  "caption_policy": "word_timed",
  "revision": 1,
  "narration_source": "original_audio",
  "tts_used": false
 }
]