[
 {
  "schema": "viralstudio.scene.v2",
  "scene_id": "sc001",
  "audio_start_s": 0.0,
  "audio_end_s": 4.3,
  "start_frame": 0,
  "end_frame": 129,
  "exact_narration": "De verdad nos tragamos ocho arañas al año mientras dormimos.",
  "word_ids": [
   "w0001",
   "w0002",
   "w0003",
   "w0004",
   "w0005",
   "w0006",
   "w0007",
   "w0008",
   "w0009",
   "w0010"
  ],
  "visual_justification": "«arañas» → spider_01; «dormimos» → sleeper_01; cifra narrada «ocho» → contador 8",
  "render_backend": "layered2d",
  "template": "character_scene",
  "asset_ids": [
   "bedroom_night_v1",
   "counter_badge",
   "month_strip",
   "sleeper_rig_v1",
   "spider_rig_v1"
  ],
  "character_ids": [
   "spider_01",
   "sleeper_01"
  ],
  "action_beats": [],
  "camera": {
   "shot": "wide",
   "movement": "slow_push"
  },
  "overlays": [
   {
    "type": "counter_badge",
    "word": "w0005",
    "value": 8.0,
    "label": "arañas al año",
    "at_s": 1.5
   },
   {
    "type": "month_strip",
    "word": "w0008",
    "highlight": [
     0,
     1,
     2,
     3,
     4,
     5,
     6,
     7,
     8,
     9,
     10,
     11
    ],
    "at_s": 2.72
   }
  ],
  "caption_policy": "word_timed",
  "revision": 1,
  "narration_source": "original_audio",
  "tts_used": false
 },
 {
  "schema": "viralstudio.scene.v2",
  "scene_id": "sc002",
  "audio_start_s": 4.3,
  "audio_end_s": 7.066667,
  "start_frame": 129,
  "end_frame": 212,
  "exact_narration": "Imagina que duermes con la boca abierta.",
  "word_ids": [
   "w0011",
   "w0012",
   "w0013",
   "w0014",
   "w0015",
   "w0016",
   "w0017"
  ],
  "visual_justification": "«duermes» → sleeper_01; «duermes» → sleeper_01.breathe; «boca» → primer plano de mouth",
  "render_backend": "layered2d",
  "template": "closeup",
  "asset_ids": [
   "bedroom_night_v1",
   "sleeper_rig_v1"
  ],
  "character_ids": [
   "sleeper_01"
  ],
  "action_beats": [
   {
    "at_s": 5.16,
    "word_id": "w0013",
    "action": "breathe",
    "target": "sleeper_01"
   }
  ],
  "camera": {
   "shot": "closeup",
   "movement": "push_in",
   "focus": {
    "target": "sleeper_01",
    "part": "mouth"
   },
   "focus_word": "w0016",
   "focus_at_s": 5.98
  },
  "overlays": [],
  "caption_policy": "word_timed",
  "revision": 1,
  "narration_source": "original_audio",
  "tts_used": false
 },
 {
  "schema": "viralstudio.scene.v2",
  "scene_id": "sc003",
  "audio_start_s": 7.066667,
  "audio_end_s": 9.7,
  "start_frame": 212,
  "end_frame": 291,
  "exact_narration": "Una araña baja del techo por su hilo.",
  "word_ids": [
   "w0018",
   "w0019",
   "w0020",
   "w0021",
   "w0022",
   "w0023",
   "w0024",
   "w0025"
  ],
  "visual_justification": "«araña» → spider_01; «baja» → spider_01.descend; «hilo» → spider_01.descend",
  "render_backend": "layered2d",
  "template": "character_scene",
  "asset_ids": [
   "bedroom_night_v1",
   "sleeper_rig_v1",
   "spider_rig_v1"
  ],
  "character_ids": [
   "spider_01",
   "sleeper_01"
  ],
  "action_beats": [
   {
    "at_s": 7.78,
    "word_id": "w0020",
    "action": "descend",
    "target": "spider_01"
   },
   {
    "at_s": 9.1,
    "word_id": "w0025",
    "action": "descend",
    "target": "spider_01"
   }
  ],
  "camera": {
   "shot": "wide",
   "movement": "pan_left"
  },
  "overlays": [],
  "caption_policy": "word_timed",
  "revision": 1,
  "narration_source": "original_audio",
  "tts_used": false
 },
 {
  "schema": "viralstudio.scene.v2",
  "scene_id": "sc004",
  "audio_start_s": 9.7,
  "audio_end_s": 12.5,
  "start_frame": 291,
  "end_frame": 375,
  "exact_narration": "Pero las arañas sienten las vibraciones.",
  "word_ids": [
   "w0026",
   "w0027",
   "w0028",
   "w0029",
   "w0030",
   "w0031"
  ],
  "visual_justification": "«arañas» → spider_01",
  "render_backend": "layered2d",
  "template": "character_scene",
  "asset_ids": [
   "bedroom_night_v1",
   "ripples",
   "sleeper_rig_v1",
   "spider_rig_v1"
  ],
  "character_ids": [
   "spider_01",
   "sleeper_01"
  ],
  "action_beats": [],
  "camera": {
   "shot": "medium",
   "movement": "pull_out"
  },
  "overlays": [
   {
    "type": "ripples",
    "word": "w0031",
    "target": "sleeper_01",
    "color": "#5fd3ff",
    "part": "body",
    "at_s": 11.46
   }
  ],
  "caption_policy": "word_timed",
  "revision": 1,
  "narration_source": "original_audio",
  "tts_used": false
 },
 {
  "schema": "viralstudio.scene.v2",
  "scene_id": "sc005",
  "audio_start_s": 12.5,
  "audio_end_s": 16.133333,
  "start_frame": 375,
  "end_frame": 484,
  "exact_narration": "Tu respiración y tu corazón son una alarma de peligro.",
  "word_ids": [
   "w0032",
   "w0033",
   "w0034",
   "w0035",
   "w0036",
   "w0037",
   "w0038",
   "w0039",
   "w0040",
   "w0041"
  ],
  "visual_justification": "Continuidad: mismos personajes y escenario que la escena anterior.",
  "render_backend": "layered2d",
  "template": "character_scene",
  "asset_ids": [
   "bedroom_night_v1",
   "ripples",
   "sleeper_rig_v1",
   "spider_rig_v1"
  ],
  "character_ids": [
   "spider_01",
   "sleeper_01"
  ],
  "action_beats": [],
  "camera": {
   "shot": "wide",
   "movement": "track"
  },
  "overlays": [
   {
    "type": "ripples",
    "word": "w0033",
    "target": "sleeper_01",
    "color": "#5fd3ff",
    "part": "mouth",
    "at_s": 12.74
   }
  ],
  "caption_policy": "word_timed",
  "revision": 1,
  "narration_source": "original_audio",
  "tts_used": false
 },
 {
  "schema": "viralstudio.scene.v2",
  "scene_id": "sc006",
  "audio_start_s": 16.133333,
  "audio_end_s": 22.229333,
  "start_frame": 484,
  "end_frame": 667,
  "exact_narration": "Ningún estudio científico ha registrado un solo caso. Es un dato inventado.",
  "word_ids": [
   "w0042",
   "w0043",
   "w0044",
   "w0045",
   "w0046",
   "w0047",
   "w0048",
   "w0049",
   "w0050",
   "w0051",
   "w0052",
   "w0053"
  ],
  "visual_justification": "«científico» → person_01; «estudio» → escenario studio_gradient_01",
  "render_backend": "infographic",
  "template": "document",
  "asset_ids": [
   "document_card",
   "studio_gradient_v1"
  ],
  "character_ids": [],
  "action_beats": [],
  "camera": {
   "shot": "medium",
   "movement": "slow_push"
  },
  "overlays": [
   {
    "type": "document_card",
    "word": "w0042",
    "title": "Ningún estudio científico ha registrado un solo caso",
    "at_s": 16.24
   }
  ],
  "caption_policy": "word_timed",
  "revision": 1,
  "narration_source": "original_audio",
  "tts_used": false
 }
]